{
  "label": "This or that",
  "title": "Hangisi doğru?",
  "a": "I look forward to hearing from you.",
  "b": "I look forward to hear from you.",
  "prompt": "A mı B mi? Yorumlara yaz 👇 ==Cevap açıklamada.==",
  "meta": {
    "topic": "look forward to + -ing",
    "caption": "Hangisi doğru? A mı B mi? 🤔\n\nA) I look forward to hearing from you.\nB) I look forward to hear from you.\n\n.\n.\n.\nCevap: A ✅\n\"Look forward to\" ifadesindeki \"to\" bir edattır (preposition), mastar değil. Edattan sonra fiil her zaman -ing alır: looking forward to SEEING you.\n\nSen hangisini seçtin? 👇 Kaydet, e-posta yazarken aç 🔖\n\nThis or that: look forward to + -ing.",
    "hashtags": ["#ingilizce", "#ahkakademi", "#businessenglish", "#ingilizcegramer", "#learnenglish", "#ielts", "#emailenglish", "#ingilizceöğreniyorum", "#grammar", "#toefl", "#englishquiz"],
    "audio_mood": "n/a (static post)"
  }
}
